{
  "$schema": "https://json-schema.org/draft/2020-12/schema",
  "$id": "https://github.com/ZarK/memex.core/schemas/contacts/record.json",
  "title": "Record",
  "description": "One fact about a person, made from claims and corrections, with provenance per field and the values that lost. See contracts/contacts-records.md and contracts/facts.md.",
  "type": "object",
  "required": [
    "id", "kind", "version", "state", "origin", "confidence", "review", "fields", "provenance",
    "alternatives", "corrected", "claims", "sources", "createdAt", "updatedAt"
  ],
  "properties": {
    "id": { "$ref": "common.json#/$defs/recordId" },
    "kind": { "$ref": "common.json#/$defs/kind" },
    "version": { "type": "integer", "minimum": 1 },
    "state": { "enum": ["active", "rejected"] },
    "origin": { "enum": ["inferred", "user"] },
    "person": {
      "$ref": "common.json#/$defs/personId",
      "description": "The person that the record is about. Not on a person record."
    },
    "other": {
      "$ref": "common.json#/$defs/personId",
      "description": "The other person of a relation, or of a date that links two persons."
    },
    "mergedInto": {
      "$ref": "common.json#/$defs/personId",
      "description": "Only on a person record: the person that this one was merged into. The record stays as a redirect, so that an unmerge works."
    },
    "confidence": { "$ref": "../user/common.json#/$defs/confidence" },
    "review": { "type": "boolean" },
    "reviewReasons": {
      "type": "array",
      "minItems": 1,
      "uniqueItems": true,
      "items": { "$ref": "../facts/facts.json#/$defs/reviewReason" }
    },
    "fields": { "type": "object" },
    "provenance": { "$ref": "../facts/facts.json#/$defs/provenance" },
    "alternatives": { "$ref": "../facts/facts.json#/$defs/alternatives" },
    "corrected": { "type": "array", "items": { "type": "string" }, "uniqueItems": true },
    "claims": {
      "type": "array",
      "items": {
        "type": "object",
        "required": ["scope", "key", "confidence"],
        "properties": {
          "scope": { "$ref": "common.json#/$defs/scope" },
          "partition": { "$ref": "../user/common.json#/$defs/partition" },
          "key": { "$ref": "../user/common.json#/$defs/claimKey" },
          "confidence": { "$ref": "../user/common.json#/$defs/confidence" },
          "seen": { "$ref": "../facts/facts.json#/$defs/seen" }
        },
        "additionalProperties": false
      }
    },
    "sources": {
      "type": "array",
      "maxItems": 100,
      "items": { "$ref": "../user/common.json#/$defs/ref" }
    },
    "createdAt": { "$ref": "../user/common.json#/$defs/utcTime" },
    "updatedAt": { "$ref": "../user/common.json#/$defs/utcTime" }
  },
  "additionalProperties": false,
  "allOf": [
    { "$ref": "common.json#/$defs/kindFields" },
    {
      "if": { "properties": { "kind": { "const": "person" } }, "required": ["kind"] },
      "then": { "not": { "anyOf": [{ "required": ["person"] }, { "required": ["other"] }] } },
      "else": { "required": ["person"], "not": { "required": ["mergedInto"] } }
    },
    {
      "if": { "properties": { "kind": { "const": "relation" } }, "required": ["kind"] },
      "then": { "required": ["other"] }
    },
    {
      "if": {
        "properties": { "kind": { "enum": ["person", "home", "workplace", "circle", "identity"] } },
        "required": ["kind"]
      },
      "then": { "not": { "required": ["other"] } }
    },
    {
      "if": { "properties": { "review": { "const": true } }, "required": ["review"] },
      "then": { "required": ["reviewReasons"] },
      "else": { "not": { "required": ["reviewReasons"] } }
    }
  ]
}
